{
  "slug": "_template",
  "title": "",
  "target_company": "",
  "company_handle": "",
  "company_linkedin_url": "",
  "company_instagram_url": "",
  "industry": "",
  "concept_type": "feature",
  "summary": "",
  "context_challenge": "",
  "solution_process": "",
  "artifacts_deliverables": "",
  "outcome_impact": "",
  "mockup_images": [],
  "tags": [],
  "linkedin_post_url": "",
  "instagram_post_url": "",
  "status": "draft",
  "publish_date": "",
  "display_order": 0
}
